{
  "$schema": "../schema.json",
  "code": "TO",
  "slug": "tonga",
  "name": "Tonga",
  "fullName": "Kingdom of Tonga",
  "viewport": {
    "center": [
      -175.198,
      -21.179
    ],
    "zoom": 8
  },
  "partnerApi": {
    "aliases": [
      "tonga",
      "kingdom of tonga"
    ]
  },
  "terminology": {
    "focusAreaSingular": "District",
    "focusAreaPlural": "Districts",
    "broaderAreaSingular": "District",
    "broaderAreaPlural": "Districts",
    "nationalLabel": "National"
  }
}
