{
  "$schema": "../schema.json",
  "code": "CK",
  "slug": "cook-islands",
  "name": "Cook Islands",
  "fullName": "Cook Islands",
  "viewport": {
    "center": [
      -159.7777,
      -21.2367
    ],
    "zoom": 11
  },
  "partnerApi": {
    "aliases": [
      "cook islands"
    ]
  },
  "terminology": {
    "focusAreaSingular": "Region",
    "focusAreaPlural": "Regions",
    "broaderAreaSingular": "Region",
    "broaderAreaPlural": "Regions",
    "nationalLabel": "National"
  }
}
